{
  "$schema": "./phase1.schema.json",
  "network": "mainnet",
  "phase": "PHASE_1",
  "chainId": 1,
  "rpcEnv": "MAINNET_RPC_URL",
  "deployerAccount": "bini-mainnet-deployer",
  "deployerAddress": "0x0000000000000000000000000000000000001010",
  "expectedGitCommit": "OWNER_RATIFICATION_REQUIRED",
  "illustrativeInputs": true,
  "expectedTokenCreationBytecodeHash": "0x6f048525545cc80f49c8c203f65d605beae18a4b0cc2d24bafaa9a57efebe872",
  "minDeployerBalanceWei": "100000000000000000",
  "timelockMinDelay": 172800,
  "adminTransferDelay": 172800,
  "timelockProposerSafe": "0x0000000000000000000000000000000000001001",
  "timelockExecutorSafe": "0x0000000000000000000000000000000000001002",
  "emergencyPauserSafe": "0x0000000000000000000000000000000000001003",
  "genesisDistributionSafe": "0x0000000000000000000000000000000000001004",
  "rewardsY1Safe": "0x0000000000000000000000000000000000002001",
  "rewardsY2ReserveSafe": "0x0000000000000000000000000000000000002002",
  "rewardsY3ReserveSafe": "0x0000000000000000000000000000000000002003",
  "rewardsY4ReserveSafe": "0x0000000000000000000000000000000000002004",
  "teamFoundersReserveSafe": "0x0000000000000000000000000000000000002005",
  "marketingOperationsSafe": "0x0000000000000000000000000000000000002006",
  "marketingMilestoneReserveSafe": "0x0000000000000000000000000000000000002007",
  "ecosystemReserveSafe": "0x0000000000000000000000000000000000002008",
  "liquidityReserveSafe": "0x0000000000000000000000000000000000002009",
  "safeThresholds": {
    "0x0000000000000000000000000000000000001001": 2, "0x0000000000000000000000000000000000001002": 2,
    "0x0000000000000000000000000000000000001003": 2, "0x0000000000000000000000000000000000001004": 2,
    "0x0000000000000000000000000000000000002001": 2, "0x0000000000000000000000000000000000002002": 2,
    "0x0000000000000000000000000000000000002003": 2, "0x0000000000000000000000000000000000002004": 2,
    "0x0000000000000000000000000000000000002005": 2, "0x0000000000000000000000000000000000002006": 2,
    "0x0000000000000000000000000000000000002007": 2, "0x0000000000000000000000000000000000002008": 2,
    "0x0000000000000000000000000000000000002009": 2
  }
}
